difficulty,category,question,option1,option2,option3,option4,correctIndex,questionChinese,optionChinese1,optionChinese2,optionChinese3,optionChinese4
easy,chemistry,What bubble gum does?,Explodes,Stretches,Freezes,Melts,1,泡泡糖会怎么样？,爆炸,拉伸,冻结,融化
easy,biology,Which animal is orange with black stripes?,Tiger,Lion,Leopard,Cheetah,0,哪种动物是橙色带黑条纹的？,老虎,狮子,豹子,猎豹
easy,biology,What color is a polar bear?,Brown,Black,White,Grey,2,北极熊是什么颜色？,棕色,黑色,白色,灰色
easy,biology,What color is a crow?,White,Black,Red,Blue,1,乌鸦是什么颜色？,白色,黑色,红色,蓝色
easy,biology,What color is a blueberry?,Red,Orange,Green,Blue,3,蓝莓是什么颜色？,红色,橙色,绿色,蓝色
easy,biology,What color is a flamingo?,Pink,Blue,Green,Black,0,火烈鸟是什么颜色？,粉色,蓝色,绿色,黑色
easy,biology,Which animal has a long trunk?,Elephant,Lion,Tiger,Bear,0,哪种动物有长鼻子？,大象,狮子,老虎,熊
easy,biology,Which animal has a shell?,Turtle,Lion,Tiger,Bear,0,哪种动物有壳？,乌龟,狮子,老虎,熊
easy,biology,Which animal has a pouch?,Kangaroo,Lion,Tiger,Bear,0,哪种动物有育儿袋？,袋鼠,狮子,老虎,熊
easy,biology,Which animal has a mane?,Lion,Tiger,Bear,Wolf,0,哪种动物有鬃毛？,狮子,老虎,熊,狼
easy,biology,Which animal has antlers?,Deer,Lion,Tiger,Bear,0,哪种动物有鹿角？,鹿,狮子,老虎,熊
easy,biology,Which animal has 8 legs?,Spider,Ant,Bee,Fly,0,哪种动物有8条腿？,蜘蛛,蚂蚁,蜜蜂,苍蝇
easy,biology,Which animal has no legs?,Snake,Lizard,Turtle,Frog,0,哪种动物没有腿？,蛇,蜥蜴,乌龟,青蛙
easy,biology,Which animal makes a web?,Spider,Bee,Ant,Fly,0,哪种动物织网？,蜘蛛,蜜蜂,蚂蚁,苍蝇
easy,biology,Which animal eats grass?,Cow,Lion,Tiger,Wolf,0,哪种动物吃草？,奶牛,狮子,老虎,狼
easy,biology,Which animal eats meat?,Lion,Cow,Sheep,Horse,0,哪种动物吃肉？,狮子,奶牛,绵羊,马
easy,biology,Which animal is very tall?,Giraffe,Lion,Tiger,Bear,0,哪种动物很高？,长颈鹿,狮子,老虎,熊